{
  "$schema": "https://json-schema.org/draft/2020-12/schema",
  "title": "ParsedDocument",
  "description": "F-EXT-001 출력 → F-EXT-002 입력. 계약 소유: 정세현 (수요: 윤지석). 데모 대상 2종(ELS, 변액)만 대응 — 범용 파서 아님",
  "type": "object",
  "required": [
    "document_id",
    "product_type",
    "parser_version",
    "pages"
  ],
  "properties": {
    "document_id": {
      "type": "string",
      "description": "업로드 단위 식별자. product_id와 다름 — 한 상품에 문서가 여러 건일 수 있다. 실물: var_samsung_b2601 이 요약서·운용설명서·수수료공시 3편이고 계약 샘플 둘이 그 중 두 건이다(parsed_variable_sample.json · parsed_variable_ops_sample.json). 값이 같아 보이는 것은 문서가 1건인 상품에서 나는 우연이고 계약이 아니다. ❗이 값은 호출자가 준다 — 파서가 파일명에서 만드는 것은 단독 실행용 폴백이고 업로드에서 충돌한다(같은 파일명 두 건이 같은 값 · 한글 파일명은 ASCII 영숫자만 남아 「제4181회.pdf」와 「키움증권_제4181회.pdf」가 둘 다 doc-4181 이 된다. 하나도 안 남으면 doc-unnamed). 결정 1.37"
    },
    "product_type": {
      "enum": [
        "ELS",
        "VARIABLE_INSURANCE"
      ],
      "description": "F-EXT-002의 상품유형 템플릿 선택 키. 데모 범위상 2종뿐"
    },
    "source_file": {
      "type": "string",
      "description": "원본 파일명. data/documents/ 는 git 제외이므로 경로가 아니라 파일명만"
    },
    "parser_version": {
      "type": "string",
      "description": "파서 버전. 같은 문서를 다시 파싱해도 같은 출력이어야 하며(P2), 출력이 달라지면 이 값이 올라가야 한다"
    },
    "parsed_at": {
      "type": "string",
      "format": "date-time"
    },
    "page_count": {
      "type": "integer",
      "minimum": 1,
      "description": "원본 PDF의 총 페이지 수. 파서는 전 페이지를 내보내므로 page_count == len(pages)가 성립한다. 스팬 검증에는 쓰지 말 것 — source_span 오프셋은 페이지 상대이므로 pages[].char_count를 봐야 한다"
    },
    "pages": {
      "type": "array",
      "minItems": 1,
      "description": "RiskItem.source_span이 가리키는 대상. 표 안의 텍스트도 읽기 순서대로 여기 포함된다 — 그래야 모든 스팬이 pages[].text 하나로 해소된다",
      "items": {
        "type": "object",
        "required": [
          "page",
          "text"
        ],
        "properties": {
          "page": {
            "type": "integer",
            "minimum": 1,
            "description": "1부터 시작 (0-base 아님)"
          },
          "text": {
            "type": "string",
            "description": "유니코드 NFC 정규화. 공백·개행을 임의로 접거나 제거하지 않는다 — 오프셋이 무의미해진다"
          },
          "char_count": {
            "type": "integer",
            "description": "text의 길이. 스팬 검증용 — 코드유닛이 아니라 코드포인트 기준"
          }
        }
      }
    },
    "tables": {
      "type": "array",
      "description": "구조화된 부가 뷰. ELS 기초자산·배리어 표처럼 행열 구조가 의미를 갖는 경우에 쓴다. 여기 없는 텍스트는 없다(pages[].text가 전량)",
      "items": {
        "type": "object",
        "required": [
          "page",
          "rows"
        ],
        "properties": {
          "page": {
            "type": "integer",
            "minimum": 1
          },
          "caption": {
            "type": [
              "string",
              "null"
            ]
          },
          "rows": {
            "type": "array",
            "items": {
              "type": "array",
              "items": {
                "type": "string"
              }
            }
          }
        }
      }
    },
    "parse_warnings": {
      "type": "array",
      "description": "파싱 실패·부분 실패는 은폐하지 않고 노출한다. 빈 배열이면 완전 성공",
      "items": {
        "type": "object",
        "required": [
          "code",
          "message"
        ],
        "properties": {
          "page": {
            "type": [
              "integer",
              "null"
            ]
          },
          "code": {
            "enum": [
              "TABLE_STRUCTURE_LOST",
              "TEXT_LAYER_MISSING",
              "ENCODING_SUSPECT",
              "MANUAL_OVERRIDE"
            ],
            "description": "MANUAL_OVERRIDE — 파서가 아니라 사람이 만든 JSON. 타임박스 우회로를 쓴 경우 반드시 표시한다"
          },
          "message": {
            "type": "string"
          }
        }
      }
    }
  },
  "$comment": "source_span 규약: RiskItem.condition.source_span의 start/end는 해당 page의 pages[].text에 대한 페이지 상대 오프셋이며 반열린 구간 [start, end)다. 문서 전역 오프셋이 아니다. 따라서 text[start:end]가 곧 value_text와 일치해야 하고, F-EXT-002의 원문 스팬 검증 후처리는 이 등식으로 검사한다."
}
