{
 "document_id": "doc-els-kiwoom-4181-simple-prospectus",
 "product_type": "ELS",
 "source_file": "els_kiwoom_4181_simple_prospectus.pdf",
 "parser_version": "0.1.0",
 "page_count": 16,
 "pages": [
  {
   "page": 1,
   "text": "[키움증권 제4181회 파생결합증권 (주가연계증권)]\n2등급, 높은위험\n정부가 본 간이투자설명서의 기재사항이 진실 또는 정확하다는 것을 인정하거나 그\n증권의 가치를 보증 또는 승인하지 아니함을 유의하시기 바랍니다. 또한 이 파생결\n합증권은「예금자보호법」에 따라 보호되지 않는 금융투자상품으로 투자원금의 손\n실이 발생할 수 있으므로 투자에 신중을 기하여 주시기 바랍니다.\n【 투자결정시 유의사항 】\n※ ELS, DLS, ELB, DLB에 대한 상품정보는 금융투자협회 전자공시서비스(dis.kofia.\nor.kr)에서 비교검색하실 수 있습니다.\n본 문서는 법령 및 내부통제기준에 따른 절차를 거쳐 제공됩니다.\n1. 투자판단시 일괄신고서, 일괄신고추가서류, 투자설명서 및 간\n이투자설명서를 반드시 참고하시기 바랍니다.\n2. 금융투자상품의 특성상 투자원금의 손실이 있을 수 있으며 예금자\n보호대상이 아닌 점을 숙지하고 투자하시기 바랍니다.\n3. 미리 정한 조건을 충족하지 못하는 경우 약정 수익을 받지 못하거\n나 상품에 따라서는 원금손실이 발생될 수 있는 복잡한 구조이므로\n관련 투자 위험요소를 충분히 이해하고 투자하시기 바랍니다.\n4. 기초자산의 가격에 연계하여 증권의 수익률이 결정되므로 투자결정시\n기초자산의 성격 및 과거 가격 추이와 현재 및 미래의 가격 변\n동성 추이, 기초자산 관련 경영환경 변화 등에 따른 권리변경\n가능성, 기초자산 거래소 소재지의 정치· 경제· 사회적불안정\n성 등을 충분히 감안하시기 바랍니다.기초자산이 신용위험인 경우 신용\n사건 발생여부에 따라 수익률이 결정되므로 신용사건 발생에 영향을 미칠\n수 있는 다양한 요소를 숙지하고 투자하여야 합니다.\n- 18 -",
   "char_count": 828
  },
  {
   "page": 2,
   "text": "5. 발행인의 신용상태에 따라 투자원금이 보호되지 않을 수 있는 신용위험\n이 있으므로 발행인의 재무현황 및 신용등급(키움증권, 발행사\n신용등급 AA, 2026년 06월 30일 한국기업평가 , 2026년 06월\n30일 한국신용평가 , 2026년 06월 30일 NICE신용평가 ) 등을\n파악하고 투자결정을 하시기 바랍니다.\n6. 투자금은 법적으로 별도 예치의무가 없기 때문에 발행인의 고\n유재산과 분리되어 보호되지 않는다는 점을 충분히 이해하고 투자\n하여야 합니다.\n7. 동 파생결합증권은 거래소에 상장되지 않아 만기 전 투자금 회수에\n어려움이 있거나 투자금 회수를 위하여 발행인에게 중도상환 요청\n시 상환비용이 크게 발생하여 투자자에게 지급되는 금액은 원금에 미\n달할 수 있으므로, 중도상환절차 및 상환가격 결정방법 등을 반드시\n확인하시기 바랍니다.\n8. 본 증권은 투자자가 이해하기 어려운 고난도금융투자상품으로 손\n실이 발생할 가능성이 있으니 투자에 유의하시기 바랍니다.\n9. 동 파생결합증권은 숙려제도 대상 투자자(65세이상 고령투자자\n, 투자성향 부적합· 부적정 투자자)의 투자유의 상품으로 지정\n된 금융상품이며, 고난도금융투자상품*인 파생결합증권은 숙려제도\n대상 투자자(개인일반투자자)의 투자유의 상품으로 지정된 금\n융상품입니다. 특별히 더 유의하셔서 투자결정 하시기 바랍니다.\n* 고난도금융투자상품: 최대원금손실 가능금액이 원금의 100분의 20을 초\n과하는 상품\n10. 동 파생결합증권은 65세이상 고령투자자 및 투자성향 부적합\n· 부적정 투자자에게 상품판매 시 전 과정을 녹취 및 보관하고\n고객요청시 제공토록 의무화 되어 있으며, 고난도금융투자상품*인\n파생결합증권은 개인 일반투자자에게 상품판매 시 전 과정을 녹\n취 및 보관하고 고객요청시 제공토록 의무화 되어 있습니다. 따라\n- 19 -",
   "char_count": 895
  },
  {
   "page": 3,
   "text": "서, 녹취를 거부하시는 경우에는 상품판매가 불가 한 점을 유의\n하시기 바랍니다.(투자자 본인에 의한 온라인 청약은 녹취가 제외됩니다.)\n* 고난도금융투자상품: 최대원금손실 가능금액이 원금의 100분의 20을 초\n과하는 상품\n11. (자료열람요구권) 금융소비자는 분쟁 조정 또는 소송의 수행 등 권\n리 구제를 위한 목적으로 금융투자상품 판매업자 등이 기록 및 유지· 관\n리하는 자료의 열람(사본의 제공 또는 청취를 포함)을 요구할 수 있습니다\n. 회사는 금융소비자로부터 분쟁 조정 신청 또는 소송 제기 등의 목적 및\n열람의 범위가 기재된 열람 요구서를 제출받아 자료 열람의 요구를 받은\n경우 그 요구받은 날부터 6영업일 이내에 해당 자료를 열람할 수 있도록\n해야 합니다. 회사는 법령, 다른 사람의 생명· 신체를 해칠 우려가 있거나\n다른 사람의 재산과 그 밖의 이익을 부당하게 침해할 우려가 있는 경우,\n회사의 영업 비밀이 현격히 침해되는 등 열람하기 부적절한 경우 금융소\n비자에게 그 사유를 알리고 열람을 제한하거나 거절할 수 있습니다.\n12. (위법계약해지권) 금융소비자는 「금융소비자 보호에 관한 법률」\n제47조 및 관련 규정이 정하는 바에 따라 금융상품판매업자등이 적합성·\n적정성 원칙, 설명의무, 불공정영업행위, 부당권유행위 금지를 위반하여\n계약을 체결하는 경우 금융소비자는 위법사실을 안 날로부터 1년, 계약 체\n결일로부터 5년 이내에 서면 등으로 계약의 해지를 요구할 수 있습니다.\n금융상품판매업자등은 해지를 요구받은 날부터 10일 이내에 금융소비자\n에게 수락여부를 통지하여야 하며, 거절할 때에는 거절 사유를 함께 통지\n하여야 합니다.\n13. (민원· 상담· 분쟁조정 연락처) 당사 인터넷 홈페이지(http://w\nww.kiwoom.com) 또는 키움금융센터(1544-9000)로 문의하시기 바랍니다.\n분쟁이 발생한 경우에는 금융감독원 민원· 신고(http://www.fss.or.kr)\n또는 대표번호(국번 없이 ☏1332) 등에 도움을 요청하실 수 있습니다.\n※ 금융투자상품 위험도 분류기준\n1등급 2등급 3등급 4등급 5등급 6등급\n구 분\n매우 높은 위험 높은 위험 다소 높은 위험 보통 위험 낮은 위험 매우 낮은 위험\n원화로 거래하는 E\n원화로 거래하는 종 원화로 거래하는 지 원화로 거래하는 EL\n파생결합증권(사채) LS 중 원금부분지 원화로 거래하는 원\n목형 원금비보장형 수형 원금비보장형 S 중 원금부분지급 -\n- 20 -",
   "char_count": 1201
  },
  {
   "page": 4,
   "text": "ELS ELB ELS ELS 급형(80% 이상 90 형(90% 이상 지급) 금지급형 ELB\n% 미만 지급)\n원화로 거래하는 D\n원화로 거래하는 DL\n파생결합증권(사채) 원화로 거래하는 원 LS 중 원금부분지 원화로 거래하는 원\n- S 중 원금부분지급 -\nDLS, DLB 금비보장형 DLS 급형(80% 이상 90 금지급형 DLB\n형 (90% 이상 지급)\n% 미만 지급)\n*[파생결합증권 평가 세부기준] : 최대원금손실 가능금액이 20%를 초과하는 경우 원칙적으로 2등급을\n부여함\n다음 어느 하나 해당 시 1개 등급 상향된 위험등급을 따름\n- 외화상품 여부: 외화로 거래되는 경우\n- 기초자산의 개수: 기초자산의 수가 3개 초과 시\n- 기초자산의 종류: 특수한 형태로 기초자산에 연계되어 상품구조에 대한 투자자의 이해가능성이 낮은\n경우\n(당사 홈페이지 'ELS 기초자산정보'에서 정의, 일간 종가데이터와 차트를 제공할 수 없는 기초자산에 연\n계하여 처음 판매하는 구조의 상품을 만들어 판매하는 경우 등)\n- 기초자산 가격의 변동성 : ELS, DLS의기초자산 중 하나라도 개별주식 종목의 주가인 경우\n-원금손실조건: ELS, DLS의 낙인배리어가 60% 이상일 경우 및 노낙인형 상품의 만기배리어가 70% 이\n상인 경우\n- 레버리지 여부: 손실발생구간의 손실배수가 기초자산 변동률의 1배를 초과 시\n※ 유동성 위험에 관한 사항\n구 분 중도환매불가 중도환매 시 비용발생 중도환매 가능\n해당여부 √\n-투자자의 요청에 의한 증권의 일부 또는 전부에 대하여 중도상환을 청구 할 수 있습니다. 단, 기초자산\n의 가격 및 시장상황 등에 따라 중도상환 시 원금손실이 발생할 수 있습니다. 원금부분지급이\n나 원금지급상품의 경우 중도상환 시 최대손실률을 초과할 수 있습니다.\n1. 상품개요\n항목 내용\n키움증권 제4181회 파생결합증권 (주가연계증권)\n종목명\n기초자산 S&P500 지수/NIKKEI225 지수/EuroStoxx50 지수\n모 집 총 액 10,000,000,000원\n- 21 -",
   "char_count": 990
  },
  {
   "page": 5,
   "text": "1증권당 액면가액 10,000원\n1증권당 발행가액 10,000원\n발행 수량 1,000,000 증권\n최소청약금액 100,000원\n청약시작일 2026년 08월 24일 (09:00 부터)\n청약기간 2026년 08월 28일 (13:00 까지)\n청약종료일\n(청약기간이후 청약취소 불가)\n숙려제도 대상\n숙려제도 2026년 08월 24일 (09:00 부터)\n청약시작일\n대상\n숙려제도 대상\n청약기간 2026년 08월 25일 (17:00 까지)\n청약종료일\n2026년 08월 26일 ~ 2026년 08월 27일\n숙려기간 (청약일(불포함)이후 2영업일로, 청약시점에 따라 다르게 적\n용됩니다.)\n가입의사확인 2026년 08월 28일 오후 1시까지\n납 입 일 2026년 08월 28일\n배정 및 환불일 2026년 08월 28일\n발 행 일 2026년 08월 31일\n만 기 일 2029년 08월 30일\n고난도금융투자상품 본 증권은 자본시장법 시행령 제2조제7호에서 정하는 고난\n해당여부 도금융투자상품에 해당하며 만기 또는 자동조기상환시 기\n초자산 가격변동에 따라 원금의 20%를 초과하는 손실이\n발생할 수 있습니다. 또한 기초자산 가격변동 이외의 요인(\n투자자 요청에 따른 중도상환, 발행인의 지급 불이행 등)으로\n추가 손실이 발생할 수 있습니다.\n※ 모든 금융투자상품에 투자하는 65세 이상 고령투자자 또는 투자성향 부적합 ·\n부적정 투자자 및 고난도금융투자상품*에 투자하는 개인일반투자자는 숙려기간 전\n까지 청약이 가능하고 숙려기간동안 최종 투자여부를 결정하여야 합니다. 이에 의\n하여 일부 투자자에 대한 숙려제도 적용에 따라 투자자간 청약기간이 달리 적용될\n수 있습니다. 자세한 문의사항은 판매처(신탁계약의 경우 해당은행)에 문의바랍니\n다.\n* 고난도금융투자상품: 최대원금손실 가능금액이 원금의 100분의 20을 초과하는\n상품\n※ 총 청약금액이 모집총액의 100%에 미달하는 경우는 부분납입으로 종결하고 해당\n- 22 -",
   "char_count": 951
  },
  {
   "page": 6,
   "text": "금액만을 발행하고, 모집총액의 100%를 초과하는 경우는 안분배정합니다. 단, 총 청\n약금액이 총 5억원에 미달되는 경우 본 증권이 취소될 수 있으며 이 경우 환불일에\n청약금액을 환불하되 이자는 가산하지 않으니 이 점 유의하시기 바랍니다.\n※ 본 증권의 이론가격은 2026년 08월 18일 9,734.81원으로 추산됩니다.\n* 이는 2026년 08월 18일 기준으로 제3의 평가기관으로부터 제시받은 이론상의 평가\n금액으로, 본 거래에 따른 위험회피 거래에 소요되는 만기까지의 헤지비용은 가산하\n지 않은 가격입니다.\n* 기초자산가격 변동성 및 기초자산 일별수익률간의 상관계수\n항 목 내 용\n- S&P500 지수 : 24.17%\n기초자산가격 변동성 - NIKKEI225 지수 : 30.42%\n- EuroStoxx50 지수 : 22.24%\n- S&P500 지수, NIKKEI225 지수 : 0.1876\n기초자산 일별수익률\n- S&P500 지수, EuroStoxx50 지수 : 0.5698\n간의 상관계수\n- NIKKEI225 지수, EuroStoxx50 지수 : 0.3094\n[변동성 기준: Volatility Surface에 대하여 VIX방법론을 이용(Jiang and Tian(2005))하여 Volatility Ter\nm Structure를 산출한 뒤 해당만기에 상응하는 변동성을 적용, 상관계수 기준: 180영업일 역사적 상관계\n수]\n※ 발행 이후 발행인의 홈페이지에 게시하는 공정가액(기준가)은 확정된 기초자산의\n기준가격과 당시 시장상황을 감안하여 추산된 헤지비용 등이 반영되므로 본 일괄신\n고추가서류 제출일 현재 제시한 가격과 달라질 수 있습니다.\n- 23 -",
   "char_count": 819
  },
  {
   "page": 7,
   "text": "2. 권리의 내용\n(1) 평가일, 관찰일 및 평가방법\n° 최초기준가격 : 최초기준가격평가일 각 기초자산의 종가\n° 최초기준가격평가일 : 2026년 08월 28일\n° 자동조기상환평가가격 : 해당 자동조기상환평가일 각 기초자산 종가\n° 자동조기상환평가일 :\n차수 자동조기상환평가일\n1차 2027년 02월 26일\n2차 2027년 08월 27일\n3차 2028년 02월 28일\n4차 2028년 08월 28일\n5차 2029년 02월 28일\n° 자동조기상환일 : 해당 자동조기상환평가일(불포함) 후 2영업일\n° 만기평가가격 : 만기평가일 각 기초자산 종가\n° 만기평가일 : 2029년 08월 28일\n(2) 손익구조\n구분 내용 투자수익률(세전)\n① 1차 자동조기상환평가일에 기초자산인 S&P500 지수, NIKK\nEI225 지수, EuroStoxx50 지수의 자동조기상환평가가격이 모\n두 각각의 최초기준가격의 85%인 85/ 85/ 85 이상인 경 5.50%\n우 1차 자동조기상환지급일에 자동조기상환되며, 상환금액은 (연 11.00%)\n다음과 같습니다.\n원금 × [100%+ 5.50%]\n② 2차 자동조기상환평가일에 기초자산인 S&P500 지수, NIKK\nEI225 지수, EuroStoxx50 지수의 자동조기상환평가가격이 모\n두 각각의 최초기준가격의 85%인 85/ 85/ 85 이상인 경 11.00%\n우 2차 자동조기상환지급일에 자동조기상환되며, 상환금액은 (연 11.00%)\n다음과 같습니다.\n원금 × [100%+ 11.00%]\n③ 3차 자동조기상환평가일에 기초자산인 S&P500 지수, NIKK\nEI225 지수, EuroStoxx50 지수의 자동조기상환평가가격이 모\n자동\n두 각각의 최초기준가격의 85%인 85/ 85/ 85 이상인 경 16.50%\n- 24 -",
   "char_count": 869
  },
  {
   "page": 8,
   "text": "조기상 우 3차 자동조기상환지급일에 자동조기상환되며, 상환금액은 (연 11.00%)\n환 다음과 같습니다.\n원금 × [100%+ 16.50%]\n④ 4차 자동조기상환평가일에 기초자산인 S&P500 지수, NIKK\nEI225 지수, EuroStoxx50 지수의 자동조기상환평가가격이 모\n두 각각의 최초기준가격의 80%인 80/ 80/ 80 이상인 경 22.00%\n우 4차 자동조기상환지급일에 자동조기상환되며, 상환금액은 (연 11.00%)\n다음과 같습니다.\n원금 × [100%+ 22.00%]\n⑤ 5차 자동조기상환평가일에 기초자산인 S&P500 지수, NIKK\nEI225 지수, EuroStoxx50 지수의 자동조기상환평가가격이 모\n두 각각의 최초기준가격의 75%인 75/ 75/ 75 이상인 경 27.50%\n우 5차 자동조기상환지급일에 자동조기상환되며, 상환금액은 (연 11.00%)\n다음과 같습니다.\n원금 × [100%+ 27.50%]\n⑥ 만기평가일에 기초자산인 S&P500 지수, NIKKEI225 지수, E\nuroStoxx50 지수의 만기평가가격이 모두 각각의 최초기준가\n격의 70%인 70/ 70/ 70 이상인 경우 만기지급일에 만기상\n환되며, 상환금액은 다음과 같습니다.\n원금 × [100%+ 33.00%]\n⑦ 위 ⑥에 해당하지 않고, 최초기준가격평가일(불포함)부터\n만기평가일(포함)까지 세 기초자산의 종가 중 어느 하나라\n도 각각의 최초기준가격의 45%인 45/ 45/ 45 미만으로\n하락한 적이 없는 경우(어느 한 기초자산의 가격만 발표되\n는 날도 포함) 만기상환금액은 다음과 같습니다.\n원금 × [100%+33.00%]\n⑧ 위 ⑥에 해당하지 않고, 최초기준가격평가일(불포함)부터\n만기평가일(포함)까지 세 기초자산의 종가 중 어느 하나라\n도 각각의 최초기준가격의 45%인 45/ 45/ 45 미만으로\n하락한 적이 있는 경우(어느 한 기초자산의 가격만 발표되\n는 날도 포함)만기상환금액은 다음과 같습니다.\n원금 × (만기평가가격/최초기준가격)\n33.00%\n(연 11.00%)\n33.00%\n(연 11.00%)\n만기\n상환\n-100% ~-30%\n(기초자산 중 하\n락폭이 큰 종목의\n수익률)\n이 경우 원금 손실이 발생합니다.\n- 25 -",
   "char_count": 1084
  },
  {
   "page": 9,
   "text": "3. 손익구조 그래프\n(1) 예상 손익구조 그래프\n제4181회 파생결합증권 (예상 손익구조 그래프)\n(2) 손실구조 설명 예시\n가) (가정) 1억원 투자\n○ 최초기준가격 평가일에 S&P500 지수의 종가, NIKKEI225 지수의 종가, EuroStoxx\n50 지수의 종가가 각각 100, 100, 100인 경우\n나) 손실사례\n- 26 -",
   "char_count": 189
  },
  {
   "page": 10,
   "text": "○ 만기평가일까지 S&P500 지수의 종가, NIKKEI225 지수의 종가, EuroStoxx50 지수\n의 종가가 어느 하나라도 낙인구간(각각 최초기준가격의 45%인 45/ 45/ 45) 미만으\n로 하락한 적이 있고, 만기평가일에 수익률이 낮은 종목이 최초기준가격의 70% 미만\n인 경우 아래와 같이 손실이 발생할 수 있습니다.\n구분 내용 손실률\n만기일에 [S&P500 지수], [NIKKEI225 지수], [EuroStoxx50 지수]의 만\n기평가가격이 각각 80, 90, 60일때\n사례1 -40%\n(더 많이 하락한 [EuroStoxx50 지수]가격 기준)\n⇒ 1억 + [1억 × (-40%)]= 6,000 만원 상환\n만기일에 [S&P500 지수], [NIKKEI225 지수], [EuroStoxx50 지수]의 만\n기평가가격이 각각 70, 85, 40일때\n사례2 -60%\n(더 많이 하락한 [EuroStoxx50 지수]가격 기준)\n⇒ 1억 + [1억 × (-60%)]= 4,000 만원 상환\n만기일에 [S&P500 지수], [NIKKEI225 지수], [EuroStoxx50 지수]의 만\n기평가가격이 각각 60, 80, 20일때\n사례3 -80%\n(더 많이 하락한 [EuroStoxx50 지수]가격 기준)\n⇒ 1억 + [1억 × (-80%)]= 2,000 만원 상환\n만기일에 [S&P500 지수], [NIKKEI225 지수], [EuroStoxx50 지수]의 만\n기평가가격이 각각 50, 75, 0일때\n사례4 -100%\n(더 많이 하락한 [EuroStoxx50 지수]가격 기준)\n⇒ 1억 + [1억 × (-100%)]= 0 원 상환(전액손실)\n- 27 -",
   "char_count": 814
  },
  {
   "page": 11,